{
  "schema": "havenwild.donor_reference_asset_catalog.v0_1",
  "updated": "2026-09-16T02:55:01+00:00",
  "purpose": "LPC source groups exposed to the in-game Art tab and future world-editor slice tool.",
  "rules": {
    "runtimePromotion": "promote exact cells/rects into generated manifests",
    "sourceOfTruth": "content/assets/lpc/lpc_slice_catalog_v0_1.json"
  },
  "records": [
    {
      "id": "lpc_terrain",
      "externalSourceId": "elizawy_lpc",
      "displayName": "LPC Terrain",
      "catalogRole": "Terrain sheets and authored autotile/stamp regions",
      "tileGridProfiles": [
        [
          32,
          32
        ],
        [
          32,
          64
        ]
      ],
      "scaleAdapterModes": [
        "native_32x32_slice",
        "promote_by_source_rect"
      ],
      "families": [
        "object.forage",
        "object.natural",
        "terrain",
        "terrain.cliff",
        "terrain.cliff_debris",
        "terrain.farm",
        "terrain.flower",
        "terrain.ground_water",
        "terrain.ice",
        "terrain.mushroom",
        "terrain.plant",
        "terrain.rock_object",
        "terrain.seasonal",
        "terrain.source",
        "terrain.structural_multi_cell",
        "terrain.tileable",
        "terrain.tree",
        "terrain.water_feature",
        "terrain.waterfall"
      ],
      "referenceUsePolicy": "project_source_allowed_with_attribution",
      "prototypeIngestPolicy": "runtime_candidate_from_pinned_lpc_source",
      "editorVisibility": {
        "standaloneEditor": "visible",
        "inGameEditorDevMode": "visible",
        "litePixelEditorPanel": "visible_as_slice_browser",
        "runtimeGameDefault": "optional_runtime_after_promotion"
      },
      "pixelEditorReferenceMode": "slice_and_promote_exact_cells",
      "runtimeRestrictions": [
        "requires explicit semantic binding before worldgen/autotile runtime use"
      ],
      "notes": [
        "29 sheet(s) indexed in content/assets/lpc/lpc_slice_catalog_v0_1.json",
        "World editor should preview source cells, then write promoted runtime bindings."
      ]
    },
    {
      "id": "lpc_objects",
      "externalSourceId": "elizawy_lpc",
      "displayName": "LPC Objects",
      "catalogRole": "Furniture, moveable objects, wall items, and small items",
      "tileGridProfiles": [
        [
          32,
          32
        ],
        [
          32,
          64
        ]
      ],
      "scaleAdapterModes": [
        "native_32x32_slice",
        "promote_by_source_rect"
      ],
      "families": [
        "object",
        "objects"
      ],
      "referenceUsePolicy": "project_source_allowed_with_attribution",
      "prototypeIngestPolicy": "runtime_candidate_from_pinned_lpc_source",
      "editorVisibility": {
        "standaloneEditor": "visible",
        "inGameEditorDevMode": "visible",
        "litePixelEditorPanel": "visible_as_slice_browser",
        "runtimeGameDefault": "optional_runtime_after_promotion"
      },
      "pixelEditorReferenceMode": "slice_and_promote_exact_cells",
      "runtimeRestrictions": [
        "requires explicit semantic binding before worldgen/autotile runtime use"
      ],
      "notes": [
        "188 sheet(s) indexed in content/assets/lpc/lpc_slice_catalog_v0_1.json",
        "World editor should preview source cells, then write promoted runtime bindings."
      ]
    },
    {
      "id": "lpc_structure",
      "externalSourceId": "elizawy_lpc",
      "displayName": "LPC Structure",
      "catalogRole": "Floors, walls, doors, roofs, fences, and building parts",
      "tileGridProfiles": [
        [
          32,
          32
        ],
        [
          32,
          64
        ]
      ],
      "scaleAdapterModes": [
        "native_32x32_slice",
        "promote_by_source_rect"
      ],
      "families": [
        "structure",
        "tiled.structure"
      ],
      "referenceUsePolicy": "project_source_allowed_with_attribution",
      "prototypeIngestPolicy": "runtime_candidate_from_pinned_lpc_source",
      "editorVisibility": {
        "standaloneEditor": "visible",
        "inGameEditorDevMode": "visible",
        "litePixelEditorPanel": "visible_as_slice_browser",
        "runtimeGameDefault": "optional_runtime_after_promotion"
      },
      "pixelEditorReferenceMode": "slice_and_promote_exact_cells",
      "runtimeRestrictions": [
        "requires explicit semantic binding before worldgen/autotile runtime use"
      ],
      "notes": [
        "98 sheet(s) indexed in content/assets/lpc/lpc_slice_catalog_v0_1.json",
        "World editor should preview source cells, then write promoted runtime bindings."
      ]
    },
    {
      "id": "lpc_characters",
      "externalSourceId": "elizawy_lpc",
      "displayName": "LPC Characters",
      "catalogRole": "Layered character body, clothing, hair, head, and props",
      "tileGridProfiles": [
        [
          32,
          32
        ],
        [
          64,
          64
        ]
      ],
      "scaleAdapterModes": [
        "native_32x32_slice",
        "promote_by_source_rect"
      ],
      "families": [
        "character",
        "characters"
      ],
      "referenceUsePolicy": "project_source_allowed_with_attribution",
      "prototypeIngestPolicy": "runtime_candidate_from_pinned_lpc_source",
      "editorVisibility": {
        "standaloneEditor": "visible",
        "inGameEditorDevMode": "visible",
        "litePixelEditorPanel": "visible_as_slice_browser",
        "runtimeGameDefault": "optional_runtime_after_promotion"
      },
      "pixelEditorReferenceMode": "slice_and_promote_exact_cells",
      "runtimeRestrictions": [
        "requires explicit semantic binding before worldgen/autotile runtime use"
      ],
      "notes": [
        "63972 sheet(s) indexed in content/assets/lpc/lpc_slice_catalog_v0_1.json",
        "World editor should preview source cells, then write promoted runtime bindings."
      ]
    },
    {
      "id": "lpc_fx",
      "externalSourceId": "elizawy_lpc",
      "displayName": "LPC FX",
      "catalogRole": "Effects and animation source sheets",
      "tileGridProfiles": [
        [
          32,
          32
        ],
        [
          32,
          64
        ]
      ],
      "scaleAdapterModes": [
        "native_32x32_slice",
        "promote_by_source_rect"
      ],
      "families": [
        "fx"
      ],
      "referenceUsePolicy": "project_source_allowed_with_attribution",
      "prototypeIngestPolicy": "runtime_candidate_from_pinned_lpc_source",
      "editorVisibility": {
        "standaloneEditor": "visible",
        "inGameEditorDevMode": "visible",
        "litePixelEditorPanel": "visible_as_slice_browser",
        "runtimeGameDefault": "optional_runtime_after_promotion"
      },
      "pixelEditorReferenceMode": "slice_and_promote_exact_cells",
      "runtimeRestrictions": [
        "requires explicit semantic binding before worldgen/autotile runtime use"
      ],
      "notes": [
        "5 sheet(s) indexed in content/assets/lpc/lpc_slice_catalog_v0_1.json",
        "World editor should preview source cells, then write promoted runtime bindings."
      ]
    }
  ]
}
